sequence,short_hash,date,status,exe_size,iso_size,message
1628,1295bb51,2025-10-19T09:10:04-07:00,failed,0,0,PS1 port: Add detailed GPU initialization debug output
1629,54fa5e0e,2025-10-19T18:49:37-07:00,failed,0,0,Add PS1 heap initialization and fix console output
1630,4f8e21e4,2025-10-20T17:32:15-07:00,failed,0,0,PS1: Implement visual debugging for boot diagnostics
1631,81a074e2,2025-10-26T16:07:37-07:00,failed,0,0,PS1: Add working triangle and rectangle rendering test
1632,2503177a,2025-10-26T16:12:01-07:00,failed,0,0,PS1: Final demo - triangle and square side-by-side
1633,38a33aff,2025-10-29T19:22:17-07:00,failed,0,0,PS1: Fix rendering order - triangle and square now display correctly
1634,a126407b,2025-10-30T14:01:44-07:00,failed,0,0,Add PS1 build automation scripts and workflow documentation
1635,30165490,2025-10-30T20:36:59-07:00,failed,0,0,PS1: Fix regression - remove premature ps1Debug init from cdromInit()
1636,ea8724b9,2025-10-31T11:24:52-07:00,exe_only,92160,0,PS1: Add detailed CD-ROM debug output and DMA-aligned buffer
1637,c8eb085b,2025-10-31T18:41:41-07:00,exe_only,92160,0,PS1: Add CD-ROM debugging and minimal test infrastructure
1638,dab87023,2025-11-01T11:34:56-07:00,exe_only,92160,0,PS1: Fix CdInit hang and enable 640x480 high res mode
1639,89e20d62,2025-11-01T16:49:21-07:00,failed,0,0,PS1: Fix compiler warnings for exit() and atoi() functions
1640,a7f89f69,2025-11-01T16:53:42-07:00,failed,0,0,PS1: Fix SDK compatibility by removing -Wpedantic flag
1641,82e6b82e,2025-11-02T10:34:16-08:00,failed,0,0,PS1: BREAKTHROUGH - CD-ROM functions work after CdInit()!
1642,d16ea258,2025-11-02T13:29:02-08:00,exe_only,88064,0,PS1: Debug CD-ROM file system - CdSearchFile() working but can't find files
1643,5fd0590a,2025-11-02T14:09:27-08:00,exe_only,90112,0,PS1: BREAKTHROUGH - Fix malloc hang with static CD buffer
1644,f17a2a16,2025-11-06T12:18:57-08:00,exe_only,90112,0,PS1: MILESTONE - CD-ROM file reading fully operational
1645,120c7cf9,2025-11-06T12:24:29-08:00,exe_only,90112,0,PS1: PROGRESS - CD-ROM data reading infrastructure working
1646,306563fd,2025-11-06T12:36:57-08:00,exe_only,90112,0,PS1: Implement complete CD-ROM resource loading system
1647,d68c8fa6,2025-11-06T12:40:05-08:00,exe_only,83968,0,PS1: MAJOR MILESTONE - Complete resource loading integration working!
1648,12331824,2025-11-06T12:45:44-08:00,exe_only,86016,0,PS1: Implement complete parseResourceFile() with PS1File support
1649,7b7aae2f,2025-11-06T13:05:19-08:00,exe_only,88064,0,PS1: Implement SCR (background) resource parsing system
1650,e4dc9039,2025-11-06T13:13:14-08:00,exe_only,86016,0,PS1: BREAKTHROUGH - Fix parseResourceFiles() hang by removing printf calls
1651,5b590698,2025-11-06T13:14:51-08:00,exe_only,86016,0,PS1: Add comprehensive filename diagnostic system for CdSearchFile
1652,71b03140,2025-11-06T13:38:32-08:00,exe_only,88064,0,BREAKTHROUGH: PS1 CD-ROM file I/O fully working
1653,2aa1f667,2025-11-06T13:52:11-08:00,exe_only,86016,0,MAJOR BREAKTHROUGH: CdSearchFile working but files not found
1654,6ca94f11,2025-11-06T13:56:19-08:00,exe_only,88064,0,DEBUGGING COMPLETE: Isolated CdSearchFile() file access issue
1655,eec22005,2025-11-06T14:12:32-08:00,exe_only,86016,0,🎉 MILESTONE: Complete PS1 file I/O system working!
1656,be113dae,2025-11-15T17:23:47-08:00,exe_only,26624,0,🔧 MAJOR FIX: Resolve PS1 boot hang caused by FntLoad/FntOpen
1657,46085252,2025-12-15T14:47:54-08:00,exe_only,22528,0,🔧 Simplify PS1 debug screens and fix color progression
1658,e2c05ebb,2025-12-19T12:44:35-08:00,exe_only,30720,0,🔧 Fix PS1 CD-ROM file I/O with CdInit() initialization
1659,0a00cba0,2025-12-19T12:52:35-08:00,exe_only,34816,0,🎉 MILESTONE: Full PS1 resource parsing working!
1660,556e172b,2025-12-19T13:03:08-08:00,exe_only,38912,0,🎮 MILESTONE: PS1 GPU graphics rendering working!
1661,6e523db1,2025-12-19T13:10:47-08:00,exe_only,38912,0,Add PS1 decompression functions and enhance graphics test
1662,1da47b1c,2025-12-19T13:31:17-08:00,exe_only,43008,0,WIP: PS1 texture rendering - 8-bit mode progress
1663,664bcca8,2025-12-20T10:07:15-08:00,exe_only,43008,0,"PS1: LZW decompression working, background rendering functional"
1664,ac17a424,2025-12-20T10:22:29-08:00,exe_only,45056,0,"PS1: 640x480 interlaced mode, correct palette colors"
1665,bd7e4e40,2025-12-20T10:25:16-08:00,exe_only,45056,0,PS1: Add POLY_FT4 scaling for background (WIP)
1666,cc19e160,2025-12-20T14:32:34-08:00,exe_only,45056,0,PS1: Background tiling with MoveImage (WIP scaling)
1667,01ef9560,2025-12-20T14:55:41-08:00,exe_only,45056,0,"PS1: Working 6-tile background (256x240 tiles, 3x2 grid)"
1668,7b9e145e,2025-12-20T15:06:40-08:00,exe_only,45056,0,PS1: Single 256x240 tile rendering (WIP background)
1669,eb61048e,2025-12-20T16:26:39-08:00,exe_only,45056,0,WIP: PS1 pixel-perfect background tiles - 2 of 3 tiles working
1670,8a5594d3,2025-12-20T16:33:46-08:00,exe_only,45056,0,"PS1: Full top row pixel-perfect background (4 tiles, 638/640px)"
1671,11bc2255,2025-12-20T16:39:31-08:00,exe_only,45056,0,PS1: Top row pixel-perfect background complete (WIP bottom row)
1672,ae2540d3,2025-12-20T16:56:36-08:00,exe_only,45056,0,WIP: PS1 bottom row investigation - LoadImage to framebuffer works
1673,71a54e36,2025-12-20T17:00:06-08:00,exe_only,47104,0,PS1: Fix bottom row corruption - handle variable-height SCR files
1674,af7d6758,2025-12-20T17:02:02-08:00,exe_only,47104,0,PS1: Prefer 640x480 SCR for full-screen testing
1675,f0272138,2025-12-20T17:07:08-08:00,exe_only,47104,0,PS1: Only decompress 640x480 SCRs for full-screen testing
1676,f8431f81,2025-12-20T17:09:18-08:00,exe_only,47104,0,PS1: Full 640-pixel width for background tiles
1677,7278b89a,2025-12-20T17:11:04-08:00,exe_only,47104,0,PS1: Simplify SCR selection in test code
1678,5899a28d,2025-12-20T17:24:41-08:00,exe_only,45056,0,🎮 MILESTONE: Pixel-perfect 640x480 background on PS1!
1679,8696ae3a,2025-12-20T17:36:43-08:00,exe_only,45056,0,🎬 PS1: Display INTRO.SCR title screen at startup
1680,61f6f6ea,2025-12-20T17:41:02-08:00,exe_only,45056,0,PS1: Add ADS/TTM resource decompression at load time
1681,06568f8e,2025-12-20T17:48:58-08:00,exe_only,69632,0,PS1: Scene playback progress - nighttime ocean scene working!
1682,6cddbb23,2025-12-20T17:51:48-08:00,exe_only,69632,0,PS1: Remove debug orange screen from resource parsing
1683,57d26ad3,2025-12-20T17:58:42-08:00,exe_only,69632,0,PS1: Add texture page support for sprite rendering
1684,467eab27,2025-12-20T18:01:08-08:00,exe_only,69632,0,PS1: Prioritize essential Johnny sprites in BMP decompression
1685,4cf37203,2025-12-21T07:14:47-08:00,exe_only,69632,0,PS1: ADS/TTM animation system working with sprite rendering
1686,35156e6d,2025-12-21T07:49:08-08:00,exe_only,69632,0,🎮 MILESTONE: PS1 instant title screen loading
1687,a157ca4b,2025-12-21T08:34:18-08:00,exe_only,69632,0,Fix title screen + ADS playback working together
1688,7a5e32fd,2025-12-21T10:07:04-08:00,exe_only,69632,0,Add HOLIDAY and CLOUDS BMPs to essential list for sprite rendering
1689,168fd491,2025-12-21T18:11:06-08:00,exe_only,67584,0,"Clean up debug code, document findings for PS1 port"
1690,3016ef19,2025-12-21T18:13:43-08:00,exe_only,67584,0,Fix background clearing - disable isbg for single-buffer mode
1691,b33a62a3,2025-12-21T18:50:34-08:00,exe_only,45056,0,Fix BMP sprite VRAM uploads - key breakthrough
1692,2da30b47,2025-12-21T18:57:46-08:00,exe_only,45056,0,Fix grDrawSprite UV calculation for 4-bit textures
1693,89440dcb,2025-12-22T14:06:47-08:00,exe_only,45056,0,🎮 MILESTONE: PS1 sprite rendering fully working!
1694,efadb1a7,2025-12-23T11:51:39-08:00,exe_only,43008,0,🎮 MILESTONE: OT primitives rendering over LoadImage background!
1695,28551aad,2025-12-23T12:22:15-08:00,exe_only,43008,0,WIP: Animated sprite placeholder over 60fps background
1696,e34c1a3a,2025-12-23T13:55:14-08:00,exe_only,43008,0,Fix grLoadBmp breaking OT rendering - root cause discovered
1697,1c34f343,2025-12-23T13:57:49-08:00,exe_only,45056,0,🎮 MILESTONE: Textured BMP sprites rendering on PS1!
1698,7a1b0cf0,2025-12-23T14:07:51-08:00,exe_only,43008,0,"Simplify BMP loading, remove printf calls"
1699,a3b89f81,2025-12-24T08:32:04-08:00,exe_only,45056,0,Add magenta transparency and BMP selection for PS1 sprites
1700,4f61f8c2,2025-12-24T08:43:12-08:00,exe_only,45056,0,Add multi-frame sprite animation support for PS1
1701,4662d04b,2025-12-24T09:05:32-08:00,exe_only,45056,0,Increase animation frame limit to 8
1702,6ecd5615,2025-12-24T09:09:55-08:00,exe_only,45056,0,Add island sprite rendering (WIP - colors need fixing)
1703,f6e7e346,2025-12-24T12:48:03-08:00,exe_only,45056,0,🎮 MILESTONE: Fix sprite animation texture wrapping on PS1
1704,4ce0d348,2025-12-25T20:07:13-08:00,failed,0,0,🏝️ MILESTONE: Island sprites rendering on PS1 via framebuffer blit
1705,d1c3d6f7,2025-12-25T20:32:19-08:00,failed,0,0,🏝️ Fix island sprite transparency on PS1
1706,483f9c63,2025-12-25T20:35:45-08:00,failed,0,0,Fix black pixels becoming transparent in palette
1707,3989f3f1,2025-12-25T20:37:49-08:00,failed,0,0,Fix 4-bit texture nibble ordering for PS1
1708,b5a1c120,2025-12-25T21:06:12-08:00,exe_only,45056,0,Fix fontID linkage for PS1 debug display
1709,10793c8f,2025-12-25T21:25:11-08:00,exe_only,47104,0,🎮 MILESTONE: On-demand BMP loading working on PS1
1710,c0f05099,2025-12-26T10:24:14-08:00,exe_only,47104,0,Add ps1_streamRead for memory-efficient dynamic loading
1711,dd00719a,2025-12-26T10:26:02-08:00,exe_only,47104,0,Add ps1_wrapBuffer to use buffers with decompress functions
1712,48d475bb,2025-12-26T10:28:00-08:00,exe_only,47104,0,Use streaming reads in ps1_loadBmpData
1713,03039edd,2025-12-26T10:30:38-08:00,exe_only,47104,0,Test streaming dynamic BMP loading with JOHNWALK.BMP
1714,4241cd66,2025-12-26T18:00:14-08:00,exe_only,47104,0,"Add multi-tile sprite infrastructure (rendering only, no loading yet)"
1715,748d8f5e,2025-12-27T10:04:03-08:00,exe_only,47104,0,Document multi-tile rendering breakthrough - VRAM collision identified
1716,4eac14c0,2025-12-27T10:20:52-08:00,exe_only,47104,0,Document multi-tile trials 10-12: 128px rows and 6-frame limit failures
1717,b3f86930,2025-12-27T10:32:38-08:00,exe_only,47104,0,Fix addPrim order: 2-frame multi-tile sprites now work
1718,4ad0e743,2025-12-27T10:51:18-08:00,exe_only,47104,0,"Checkpoint: 2-frame multi-tile works, 3+ breaks"
1719,dc36f7b1,2025-12-27T11:05:50-08:00,exe_only,47104,0,"Milestone: 3 frames work, 2 bottom tiles work, 3rd breaks"
1720,26e02eb6,2025-12-27T17:21:04-08:00,exe_only,47104,0,Multi-tile sprites: 3 frames with feet working (DrawSync fix)
1721,8c16610a,2025-12-29T06:51:46-08:00,exe_only,51200,0,WIP: Debug session - more frames loading but island/feet broken
1722,da4ad08f,2025-12-29T17:53:15-08:00,exe_only,47104,0,RAM-based rendering: All 42 animation frames load (background corruption WIP)
1723,8a1048e6,2025-12-30T09:03:36-08:00,exe_only,49152,0,"Milestone: All 42 Johnny frames render, bg stable, frames overlap"
1724,8b03359d,2025-12-30T09:19:52-08:00,exe_only,47104,0,MAJOR MILESTONE: Johnny walks on island with proper frame wiping!
1725,218ef15a,2025-12-30T09:24:37-08:00,exe_only,47104,0,Fix animation timing: 12 FPS instead of 4 FPS
1726,7b86b49c,2025-12-30T09:57:09-08:00,success,47104,2170896,chore: Reorganize repository structure
1727,bd34be6c,2025-12-30T10:22:00-08:00,success,47104,7963872,feat(ps1): Switch to pre-extracted resources for faster loading
1728,3664f7d7,2025-12-30T10:52:25-08:00,success,47104,7963872,"fix(ps1): Simplify SCR loading, improve BMP loading robustness"
1729,d01a8159,2025-12-30T10:55:33-08:00,success,47104,7963872,chore: Add release.sh script and VERSION file
1730,37b1ef3c,2026-01-10T21:06:39-08:00,success,57344,8295504,fix(ps1): Wrap sprite indices to handle 16-frame cap
1731,b82eb8bb,2026-01-10T22:46:41-08:00,success,61440,8335488,"feat(ps1): Add ADS scene support, fix VSync timing"
1732,632e8bbb,2026-01-10T22:50:28-08:00,success,61440,8335488,fix(ps1): Load ocean background before animation to fix black bar
1733,65735e14,2026-01-10T22:56:20-08:00,success,63488,8337840,"fix(ps1): Zero sprite pointers in ttmInitSlot, test GJHOT.TTM"
1734,0bf13f72,2026-01-10T23:01:04-08:00,success,63488,8337840,fix(ps1): Initialize nextTile to NULL in all PS1Surface allocations
1735,538e3ce2,2026-01-25T20:21:46-08:00,success,61440,8335488,"fix(ps1): Reduce sprite memory, remove debug markers, document issues"
1736,71f1d352,2026-02-07T08:55:53-08:00,success,86016,8363712,"feat(ps1): Enable storyPlay scene loop, implement grFadeOut, fix sprite persiste"
1737,37765bcf,2026-02-07T15:29:54-08:00,success,86016,8363712,"feat(ps1): Random scene selection, crash-safe resource loading, walk sprite clea"
1738,1f97b08c,2026-02-07T18:17:08-08:00,success,88064,8507184,"feat(ps1): SPU audio, fix sprite blink, fix scene variety, fix black backgrounds"
1739,5dbcdd16,2026-02-07T20:17:01-08:00,success,88064,8507184,fix(ps1): Fix black ocean by freeing tiles before SCR reload
1740,a87aa57f,2026-02-07T21:19:38-08:00,success,86016,8504832,"release: v0.3.3-ps1 - Fix ADS scene loading, skip broken LZW decompression"
1741,5ca5d741,2026-02-07T21:31:38-08:00,success,86016,8504832,fix(ps1): Fix sprite flickering by replacing cross-thread invalidation with safe
1742,0a1cf18c,2026-02-19T09:26:54-08:00,success,86016,8504832,fix(ps1): improve compositing speed and stabilize walk sprite replay
1743,d3a4649e,2026-02-20T12:15:50-08:00,success,86016,8504832,fix(ps1): stabilize long-run sprites with zero-copy indexed frames
1744,6090a735,2026-03-04T14:09:31-08:00,success,86016,8504832,Add PS1 debug-bar screenshot decoder tool
1745,55bf4240,2026-03-04T14:11:36-08:00,failed,0,0,Commit PS1 telemetry bar implementation and scene diagnostics
1746,12fdc519,2026-03-10T14:31:12-07:00,failed,0,0,PS1: intermediate black screen fixed
1747,0432a49b,2026-03-18T08:16:24-07:00,success,104448,34647312,Add PS1 pack pipeline and STAND restore pilot
1748,3d6fafa7,2026-03-18T08:39:09-07:00,success,104448,34647312,Add JOHNNY restore pilot and multi-pilot table
1749,81c1dcc3,2026-03-18T09:02:27-07:00,success,106496,34649664,Prime PS1 pilot scene resources from generated specs
1750,365ebb1a,2026-03-20T13:56:30-07:00,success,110592,34654368,Advance PS1 restore rollout and narrow pilot priming
1751,6dae8410,2026-03-21T09:02:06-07:00,success,112640,34656720,Fix PS1 first-handoff blackscreen
1752,21ada788,2026-03-21T12:01:27-07:00,success,112640,38904432,Add PSB sprite transcoder: pre-swap nibbles offline for PS1
1753,d85aa389,2026-03-21T12:04:38-07:00,success,116736,38909136,Merge branch 'worktree-agent-a0c0294b' into ps1
1754,4ce9d46f,2026-03-21T12:42:43-07:00,success,122880,38916192,Add PSB-backed scene packs and refresh restore artifacts
1755,f2c33ca3,2026-03-21T17:15:34-07:00,success,122880,38916192,"PS1 micro-optimizations: dirty-rect, palette LUT, compositing merge, hash lookup"
1756,84021fb6,2026-03-21T20:10:23-07:00,success,122880,38916192,"Add headless regtest harness, test instrumentation, refresh docs and research ar"
1757,bfce49c7,2026-03-21T21:07:39-07:00,success,122880,38916192,"Fix PS1 audio: correct ADSR, key-off before reuse, L1+SELECT mute"
1758,2069f333,2026-03-22T07:33:27-07:00,success,122880,38916192,Add visual scene and sprite detection system for automated testing
1759,b4476f3d,2026-03-22T10:28:49-07:00,success,131072,38925600,"Add pause menu, game features, closed captions, and accessibility stubs"
1760,a64524c4,2026-03-28T09:05:42-07:00,failed,0,0,Add canonical host baseline reference corpus
1761,7a3d4b49,2026-03-28T22:29:45-07:00,failed,0,0,Add HTML output for PS1 reference compares
1762,5b776e5a,2026-03-29T10:25:13-07:00,success,122880,38916192,Restore clean buildable state from f2c33ca3
1763,69432ead,2026-03-29T10:27:58-07:00,success,122880,38916192,Add story single boot mode for exact-scene PS1 testing
1764,d3b36ccc,2026-03-29T10:30:04-07:00,success,122880,38916192,Update regtest timing: 9000 frames (150 sec) for scene content
1765,4054755a,2026-03-29T12:04:01-07:00,success,122880,38916192,Add seed support and direct scene path for deterministic validation
1766,9d8ef531,2026-03-29T12:05:36-07:00,success,122880,38916192,Add local vision classifier reference pipeline
1767,0fadf79d,2026-03-29T12:53:17-07:00,success,122880,38916192,Expand vision pipeline publishing artifacts
1768,eadff0cf,2026-03-31T13:05:34-07:00,failed,0,0,Stabilize host truth expectations and reproducibility
1769,437895b8,2026-03-31T13:21:02-07:00,failed,0,0,Add refresh command for strict host truth review
1770,7e29e0e7,2026-03-31T13:39:12-07:00,failed,0,0,Harden host scene capture validation and timeouts
1771,25630be3,2026-03-31T13:48:16-07:00,failed,0,0,Isolate host review refresh from stale capture processes
1772,5569018e,2026-03-31T13:58:23-07:00,failed,0,0,Clean refresh temp state and orphaned Xvfb
1773,7719b911,2026-03-31T14:08:30-07:00,failed,0,0,Add canonical host review verification summary
1774,d92d45ce,2026-03-31T14:18:36-07:00,failed,0,0,Add stable digest to host review verification summary
1775,8eea65d6,2026-03-31T14:21:01-07:00,failed,0,0,Refuse refresh on dirty tracked host review inputs
1776,00367d90,2026-03-31T14:31:26-07:00,failed,0,0,Add read-only host review verifier
1777,8165b566,2026-03-31T14:41:00-07:00,failed,0,0,Emit one-line host review verification summary
1778,995926bb,2026-03-31T14:51:13-07:00,failed,0,0,Add negative test for host review verifier
1779,6b4a89b9,2026-03-31T15:01:30-07:00,failed,0,0,Add head-mismatch negative test for host review verifier
1780,93682af5,2026-03-31T15:11:59-07:00,failed,0,0,Compile deterministic semantic truth from host metadata
1781,de95b66b,2026-03-31T15:21:55-07:00,failed,0,0,Enrich host semantic truth with states and reasons
1782,a297794e,2026-03-31T15:32:03-07:00,failed,0,0,Add scene signatures and transition semantics
1783,304fbd34,2026-03-31T15:41:57-07:00,failed,0,0,Add identification tokens to semantic truth
1784,b21f1152,2026-03-31T15:52:33-07:00,failed,0,0,Add semantic scene identification selfcheck
1785,ecc2b628,2026-03-31T16:02:18-07:00,failed,0,0,Require explicit identified status in scene matcher
1786,ed625ffe,2026-03-31T16:14:46-07:00,failed,0,0,Enforce identification confusion audit in host review
1787,aa848207,2026-03-31T16:23:26-07:00,failed,0,0,Require ratio separation in scene identification audit
1788,5c180389,2026-03-31T16:35:42-07:00,failed,0,0,Audit partial-timeline scene identification robustness
1789,f7125dd0,2026-03-31T16:54:59-07:00,failed,0,0,Require rejection of low-signal challenge queries
1790,7b4f6fa2,2026-03-31T17:14:12-07:00,failed,0,0,Audit temporal stability of scene identification
1791,c05fe759,2026-03-31T17:23:41-07:00,failed,0,0,Weight active-frame evidence in scene matching
1792,0beaa9a5,2026-03-31T17:33:52-07:00,failed,0,0,Require monotonic temporal identification confidence
1793,62df9674,2026-03-31T17:45:04-07:00,failed,0,0,Expand challenge-set rejection coverage
1794,14ab86d8,2026-03-31T17:54:01-07:00,failed,0,0,Add evidence summaries to scene matcher output
1795,a44708fa,2026-03-31T18:04:52-07:00,failed,0,0,Publish HTML review for identification audits
1796,9cd84885,2026-03-31T18:15:35-07:00,failed,0,0,Link identification review to captured frames
1797,dcc04398,2026-03-31T18:25:29-07:00,failed,0,0,Add frame thumbnails to identification review
1798,07270647,2026-03-31T18:34:39-07:00,failed,0,0,Show evidence delta in identification review
1799,9747ae91,2026-03-31T18:45:13-07:00,failed,0,0,Add semantic scene summaries to identification review
1800,45c80807,2026-03-31T18:54:54-07:00,failed,0,0,Summarize query-specific semantic slices
1801,042f8c35,2026-03-31T19:04:43-07:00,failed,0,0,Show active evidence profiles in identification review
1802,61efd98b,2026-03-31T19:15:08-07:00,failed,0,0,Require active evidence in identified query audits
1803,0208559c,2026-03-31T19:25:14-07:00,failed,0,0,Require semantic evidence in scene matcher decisions
1804,937f2f1e,2026-03-31T19:35:33-07:00,failed,0,0,Add pose alignment to scene matcher scoring
1805,880d603b,2026-03-31T19:45:29-07:00,failed,0,0,Add pose-conflict challenge queries
1806,b1be1f67,2026-03-31T19:55:32-07:00,failed,0,0,Enforce confidence ceilings on challenge queries
1807,8387cea1,2026-03-31T20:05:40-07:00,failed,0,0,Show challenge confidence budgets in review
1808,14e04b7e,2026-03-31T20:16:14-07:00,failed,0,0,Add challenge budgets to verification summaries
1809,cfef612d,2026-03-31T20:26:33-07:00,failed,0,0,Add challenge headroom metrics to audits and summaries
1810,8dc5063d,2026-03-31T20:36:32-07:00,failed,0,0,Highlight tight challenge headroom in review
1811,d45ebd95,2026-03-31T20:46:51-07:00,failed,0,0,Count tight challenge budgets in verification summary
1812,a82563cc,2026-03-31T20:56:53-07:00,failed,0,0,Add risk status to summaries and review
1813,feea1726,2026-03-31T21:04:54-07:00,failed,0,0,Derive review risk from challenge headroom
1814,e8bcc5c9,2026-03-31T21:19:02-07:00,failed,0,0,Publish tightest challenge pressure in audits
1815,747c65b8,2026-03-31T21:37:39-07:00,failed,0,0,Reduce background-only scene match inflation
1816,44a50379,2026-03-31T21:47:52-07:00,failed,0,0,Penalize contradictory active-state scene matches
1817,75841792,2026-03-31T21:51:06-07:00,failed,0,0,Limit contradiction penalties to negative pressure only
1818,fa97d0f9,2026-03-31T21:55:44-07:00,failed,0,0,Tighten challenge realism and unknown-family scoring
1819,ab2f01b0,2026-03-31T22:07:51-07:00,failed,0,0,Weight context alignment in background scene matching
1820,0fd9d689,2026-03-31T22:17:49-07:00,failed,0,0,Reduce generic overlap bias in unknown-family matching
1821,b33f9c98,2026-03-31T22:27:43-07:00,failed,0,0,Penalize incomplete active coverage in unknown-family matching
1822,f88d37b9,2026-03-31T22:38:12-07:00,failed,0,0,Downweight single-active mixed unknown-family queries
1823,587de3e9,2026-03-31T22:48:33-07:00,failed,0,0,Further reduce confidence for single-active mixed slices
1824,b0f0e17c,2026-03-31T22:58:42-07:00,failed,0,0,Lower confidence for background-plus-active mixed slices
1825,ed373db8,2026-03-31T23:13:37-07:00,failed,0,0,Downweight generic overlap in unknown-family scene matching
1826,102c2757,2026-03-31T23:22:28-07:00,failed,0,0,Add transition-pattern alignment to scene matching
1827,b554734a,2026-03-31T23:40:06-07:00,failed,0,0,Add context-timeline alignment to scene matching
1828,e1a08407,2026-03-31T23:51:44-07:00,failed,0,0,Add subject timing and persistence to scene matching
1829,3cbbf02d,2026-03-31T23:55:32-07:00,failed,0,0,Gate subject timing boosts on active alignment
1830,c093c847,2026-04-01T00:10:39-07:00,failed,0,0,Add subject exit and recovery semantics to scene matching
1831,5cf09c67,2026-04-01T00:20:28-07:00,failed,0,0,Add actor phase sequencing to scene matching
1832,dd3ff661,2026-04-01T00:30:57-07:00,failed,0,0,Tighten unknown-family state-sequence penalties
1833,fef19f6d,2026-04-01T00:42:35-07:00,failed,0,0,Add transition-pair sequencing to scene matching
1834,58ec878e,2026-04-01T01:01:13-07:00,failed,0,0,Add timed transition sequencing to scene matching
1835,a63bea53,2026-04-01T01:10:56-07:00,failed,0,0,Add subject-activity sequencing to scene matching
1836,feb85999,2026-04-01T01:20:33-07:00,failed,0,0,Reduce mixed-slice subject-activity confidence
1837,c7fca140,2026-04-01T01:31:33-07:00,failed,0,0,Reclassify separated mixed unknown-family slices
1838,032e9ff1,2026-04-01T01:52:30-07:00,failed,0,0,Expose borrowed-background risk in matcher and review
1839,0057fa50,2026-04-01T02:01:27-07:00,failed,0,0,Make borrowed-background mixes explicit decisions
1840,1d9c1376,2026-04-01T02:04:23-07:00,failed,0,0,Add background provenance alignment to scene matching
1841,61a0d56b,2026-04-01T02:13:30-07:00,failed,0,0,Penalize borrowed-background mismatch in scene matching
1842,ae7db329,2026-04-01T02:31:56-07:00,failed,0,0,Add query contamination profiling to scene matcher
1843,adb3282a,2026-04-01T02:41:43-07:00,failed,0,0,Penalize sparse active evidence in mixed scene queries
1844,05a1475b,2026-04-01T02:52:24-07:00,failed,0,0,Penalize fragmented active coverage in mixed queries
1845,56695e1c,2026-04-01T03:01:57-07:00,failed,0,0,Penalize active semantic diversity in mixed queries
1846,410f3ea2,2026-04-01T03:12:31-07:00,failed,0,0,Penalize late active islands in mixed queries
1847,34da30fa,2026-04-01T03:22:04-07:00,failed,0,0,Clamp unknown-family scene scores at zero
1848,1d39ecf2,2026-04-01T03:32:33-07:00,failed,0,0,Reduce generic overlap credit for background-only queries
1849,a64c8601,2026-04-01T03:42:30-07:00,failed,0,0,Penalize borrowed-background context carryover
1850,6ad7040a,2026-04-01T03:52:50-07:00,failed,0,0,Penalize blended active narratives in mixed queries
1851,8f8c1f36,2026-04-01T04:02:53-07:00,failed,0,0,Further reduce background-only overlap credit
1852,bfa8754c,2026-04-01T04:12:45-07:00,failed,0,0,Penalize overweight single-active alignment in mixed queries
1853,b0ff1b62,2026-04-01T04:23:08-07:00,failed,0,0,Penalize low-novelty multi-active mixed queries
1854,daf7b98f,2026-04-01T04:34:05-07:00,failed,0,0,Penalize late active island context carryover
1855,0ae83b79,2026-04-01T04:43:02-07:00,failed,0,0,Further reduce background-only semantic overlap credit
1856,cd015b13,2026-04-01T04:53:14-07:00,failed,0,0,Further tighten background-only low-signal scoring
1857,0e5c1faa,2026-04-01T05:03:27-07:00,failed,0,0,Trim residual background-only overlap scoring
1858,f9581bad,2026-04-01T05:17:43-07:00,failed,0,0,Trim low-signal background-only scene overlap further
1859,2e5a2ec3,2026-04-01T05:34:19-07:00,failed,0,0,Penalize borrowed background mismatch in single-active mixed queries
1860,f185bbe1,2026-04-01T05:44:00-07:00,failed,0,0,Further trim residual background-only scene credit
