sequence,short_hash,date,status,exe_size,iso_size,message
4915,a297794e,2026-03-31T15:32:03-07:00,failed,0,0,Add scene signatures and transition semantics
4916,304fbd34,2026-03-31T15:41:57-07:00,failed,0,0,Add identification tokens to semantic truth
4917,b21f1152,2026-03-31T15:52:33-07:00,failed,0,0,Add semantic scene identification selfcheck
4918,ecc2b628,2026-03-31T16:02:18-07:00,failed,0,0,Require explicit identified status in scene matcher
4919,ed625ffe,2026-03-31T16:14:46-07:00,failed,0,0,Enforce identification confusion audit in host review
4920,aa848207,2026-03-31T16:23:26-07:00,failed,0,0,Require ratio separation in scene identification audit
4921,5c180389,2026-03-31T16:35:42-07:00,failed,0,0,Audit partial-timeline scene identification robustness
4922,f7125dd0,2026-03-31T16:54:59-07:00,failed,0,0,Require rejection of low-signal challenge queries
4923,7b4f6fa2,2026-03-31T17:14:12-07:00,failed,0,0,Audit temporal stability of scene identification
4924,c05fe759,2026-03-31T17:23:41-07:00,failed,0,0,Weight active-frame evidence in scene matching
4925,0beaa9a5,2026-03-31T17:33:52-07:00,failed,0,0,Require monotonic temporal identification confidence
4926,62df9674,2026-03-31T17:45:04-07:00,failed,0,0,Expand challenge-set rejection coverage
4927,14ab86d8,2026-03-31T17:54:01-07:00,failed,0,0,Add evidence summaries to scene matcher output
4928,a44708fa,2026-03-31T18:04:52-07:00,failed,0,0,Publish HTML review for identification audits
4929,9cd84885,2026-03-31T18:15:35-07:00,failed,0,0,Link identification review to captured frames
4930,dcc04398,2026-03-31T18:25:29-07:00,failed,0,0,Add frame thumbnails to identification review
4931,07270647,2026-03-31T18:34:39-07:00,failed,0,0,Show evidence delta in identification review
4932,9747ae91,2026-03-31T18:45:13-07:00,failed,0,0,Add semantic scene summaries to identification review
4933,45c80807,2026-03-31T18:54:54-07:00,failed,0,0,Summarize query-specific semantic slices
4934,042f8c35,2026-03-31T19:04:43-07:00,failed,0,0,Show active evidence profiles in identification review
4935,61efd98b,2026-03-31T19:15:08-07:00,failed,0,0,Require active evidence in identified query audits
4936,0208559c,2026-03-31T19:25:14-07:00,failed,0,0,Require semantic evidence in scene matcher decisions
4937,937f2f1e,2026-03-31T19:35:33-07:00,failed,0,0,Add pose alignment to scene matcher scoring
4938,880d603b,2026-03-31T19:45:29-07:00,failed,0,0,Add pose-conflict challenge queries
4939,b1be1f67,2026-03-31T19:55:32-07:00,failed,0,0,Enforce confidence ceilings on challenge queries
4940,8387cea1,2026-03-31T20:05:40-07:00,failed,0,0,Show challenge confidence budgets in review
4941,14e04b7e,2026-03-31T20:16:14-07:00,failed,0,0,Add challenge budgets to verification summaries
4942,cfef612d,2026-03-31T20:26:33-07:00,failed,0,0,Add challenge headroom metrics to audits and summaries
4943,8dc5063d,2026-03-31T20:36:32-07:00,failed,0,0,Highlight tight challenge headroom in review
4944,d45ebd95,2026-03-31T20:46:51-07:00,failed,0,0,Count tight challenge budgets in verification summary
4945,a82563cc,2026-03-31T20:56:53-07:00,failed,0,0,Add risk status to summaries and review
4946,feea1726,2026-03-31T21:04:54-07:00,failed,0,0,Derive review risk from challenge headroom
4947,e8bcc5c9,2026-03-31T21:19:02-07:00,failed,0,0,Publish tightest challenge pressure in audits
4948,747c65b8,2026-03-31T21:37:39-07:00,failed,0,0,Reduce background-only scene match inflation
4949,44a50379,2026-03-31T21:47:52-07:00,failed,0,0,Penalize contradictory active-state scene matches
4950,75841792,2026-03-31T21:51:06-07:00,failed,0,0,Limit contradiction penalties to negative pressure only
4951,fa97d0f9,2026-03-31T21:55:44-07:00,failed,0,0,Tighten challenge realism and unknown-family scoring
4952,ab2f01b0,2026-03-31T22:07:51-07:00,failed,0,0,Weight context alignment in background scene matching
4953,0fd9d689,2026-03-31T22:17:49-07:00,failed,0,0,Reduce generic overlap bias in unknown-family matching
4954,b33f9c98,2026-03-31T22:27:43-07:00,failed,0,0,Penalize incomplete active coverage in unknown-family matching
4955,f88d37b9,2026-03-31T22:38:12-07:00,failed,0,0,Downweight single-active mixed unknown-family queries
4956,587de3e9,2026-03-31T22:48:33-07:00,failed,0,0,Further reduce confidence for single-active mixed slices
4957,b0f0e17c,2026-03-31T22:58:42-07:00,failed,0,0,Lower confidence for background-plus-active mixed slices
4958,ed373db8,2026-03-31T23:13:37-07:00,failed,0,0,Downweight generic overlap in unknown-family scene matching
4959,102c2757,2026-03-31T23:22:28-07:00,failed,0,0,Add transition-pattern alignment to scene matching
4960,b554734a,2026-03-31T23:40:06-07:00,failed,0,0,Add context-timeline alignment to scene matching
4961,e1a08407,2026-03-31T23:51:44-07:00,failed,0,0,Add subject timing and persistence to scene matching
4962,3cbbf02d,2026-03-31T23:55:32-07:00,failed,0,0,Gate subject timing boosts on active alignment
4963,c093c847,2026-04-01T00:10:39-07:00,failed,0,0,Add subject exit and recovery semantics to scene matching
4964,5cf09c67,2026-04-01T00:20:28-07:00,failed,0,0,Add actor phase sequencing to scene matching
4965,dd3ff661,2026-04-01T00:30:57-07:00,failed,0,0,Tighten unknown-family state-sequence penalties
4966,fef19f6d,2026-04-01T00:42:35-07:00,failed,0,0,Add transition-pair sequencing to scene matching
4967,58ec878e,2026-04-01T01:01:13-07:00,failed,0,0,Add timed transition sequencing to scene matching
4968,a63bea53,2026-04-01T01:10:56-07:00,failed,0,0,Add subject-activity sequencing to scene matching
4969,feb85999,2026-04-01T01:20:33-07:00,failed,0,0,Reduce mixed-slice subject-activity confidence
4970,c7fca140,2026-04-01T01:31:33-07:00,failed,0,0,Reclassify separated mixed unknown-family slices
4971,032e9ff1,2026-04-01T01:52:30-07:00,failed,0,0,Expose borrowed-background risk in matcher and review
4972,0057fa50,2026-04-01T02:01:27-07:00,failed,0,0,Make borrowed-background mixes explicit decisions
4973,1d9c1376,2026-04-01T02:04:23-07:00,failed,0,0,Add background provenance alignment to scene matching
4974,61a0d56b,2026-04-01T02:13:30-07:00,failed,0,0,Penalize borrowed-background mismatch in scene matching
4975,ae7db329,2026-04-01T02:31:56-07:00,failed,0,0,Add query contamination profiling to scene matcher
4976,adb3282a,2026-04-01T02:41:43-07:00,failed,0,0,Penalize sparse active evidence in mixed scene queries
4977,05a1475b,2026-04-01T02:52:24-07:00,failed,0,0,Penalize fragmented active coverage in mixed queries
4978,56695e1c,2026-04-01T03:01:57-07:00,failed,0,0,Penalize active semantic diversity in mixed queries
4979,410f3ea2,2026-04-01T03:12:31-07:00,failed,0,0,Penalize late active islands in mixed queries
4980,34da30fa,2026-04-01T03:22:04-07:00,failed,0,0,Clamp unknown-family scene scores at zero
4981,1d39ecf2,2026-04-01T03:32:33-07:00,failed,0,0,Reduce generic overlap credit for background-only queries
4982,a64c8601,2026-04-01T03:42:30-07:00,failed,0,0,Penalize borrowed-background context carryover
4983,6ad7040a,2026-04-01T03:52:50-07:00,failed,0,0,Penalize blended active narratives in mixed queries
4984,8f8c1f36,2026-04-01T04:02:53-07:00,failed,0,0,Further reduce background-only overlap credit
4985,bfa8754c,2026-04-01T04:12:45-07:00,failed,0,0,Penalize overweight single-active alignment in mixed queries
4986,b0ff1b62,2026-04-01T04:23:08-07:00,failed,0,0,Penalize low-novelty multi-active mixed queries
4987,daf7b98f,2026-04-01T04:34:05-07:00,failed,0,0,Penalize late active island context carryover
4988,0ae83b79,2026-04-01T04:43:02-07:00,failed,0,0,Further reduce background-only semantic overlap credit
4989,cd015b13,2026-04-01T04:53:14-07:00,failed,0,0,Further tighten background-only low-signal scoring
4990,0e5c1faa,2026-04-01T05:03:27-07:00,failed,0,0,Trim residual background-only overlap scoring
4991,f9581bad,2026-04-01T05:17:43-07:00,failed,0,0,Trim low-signal background-only scene overlap further
4992,2e5a2ec3,2026-04-01T05:34:19-07:00,failed,0,0,Penalize borrowed background mismatch in single-active mixed queries
4993,f185bbe1,2026-04-01T05:44:00-07:00,failed,0,0,Further trim residual background-only scene credit
4994,64741f57,2026-04-01T05:54:10-07:00,failed,0,0,Reduce broad scene-similarity credit for background-only queries
4995,a21c91ce,2026-04-01T06:04:27-07:00,failed,0,0,Reduce scene-family bonus for background-only queries
4996,587aa745,2026-04-01T06:14:35-07:00,failed,0,0,Reduce frame-signature credit for background-only queries
4997,ce245671,2026-04-01T06:25:04-07:00,failed,0,0,Drop generic semantic overlap for background-only queries
4998,e90b0e93,2026-04-01T06:34:56-07:00,failed,0,0,Trim residual background-only structural overlap
4999,2632a91f,2026-04-01T06:44:58-07:00,failed,0,0,Lower residual transition and context credit for background-only queries
5000,d0262e81,2026-04-01T06:55:21-07:00,failed,0,0,Remove broad scene-summary signals from background-only queries
5001,5af4d855,2026-04-01T07:05:29-07:00,failed,0,0,Return saved-zone layer to the surface pool
5002,c82c1aac,2026-04-01T07:09:04-07:00,failed,0,0,Increase host surface pool headroom for deterministic capture
5003,3a2127fa,2026-04-01T07:25:46-07:00,failed,0,0,Remove final context-set credit from background-only queries
5004,554de336,2026-04-01T07:36:57-07:00,failed,0,0,Remove background-only family bonus entirely
5005,60437f8e,2026-04-01T07:57:02-07:00,failed,0,0,Increase exact active-state evidence in scene matching
5006,7b582d28,2026-04-01T08:02:19-07:00,failed,0,0,Balance exact active-state boosts for unknown-family queries
5007,15ec31cc,2026-04-01T08:16:45-07:00,failed,0,0,Increase exact active-subject evidence in scene matching
5008,b535f89b,2026-04-01T08:28:04-07:00,failed,0,0,Promote active state-set alignment in scene matching
5009,e572d076,2026-04-01T08:37:01-07:00,failed,0,0,Increase actor-bearing scene-family evidence
5010,65b29ffd,2026-04-01T08:47:35-07:00,failed,0,0,Increase exact active-state evidence in scene matching
5011,27a26a90,2026-04-01T08:57:33-07:00,failed,0,0,Strengthen exact actor-bearing context alignment
5012,780e7db0,2026-04-01T09:07:53-07:00,failed,0,0,Increase active pose-set alignment weight
5013,cd26e6ad,2026-04-01T09:18:18-07:00,failed,0,0,Promote scene-trait alignment in scene matching
5014,4af1b928,2026-04-01T09:28:26-07:00,failed,0,0,Gate generic pose and activity overlap on active alignment
5015,c156ec87,2026-04-01T09:37:27-07:00,failed,0,0,Gate generic token overlap on active alignment
5016,009fd1ec,2026-04-01T09:47:55-07:00,failed,0,0,Gate exact subject and context matches on active alignment
5017,2295fc7a,2026-04-01T09:57:57-07:00,failed,0,0,Reduce non-active shared-frame overlap credit
5018,13616579,2026-04-01T10:08:04-07:00,failed,0,0,Increase active-frame coverage evidence
5019,dedcfc21,2026-04-01T10:18:22-07:00,failed,0,0,Increase late active-island rejection pressure
5020,4adfe197,2026-04-01T10:48:39-07:00,failed,0,0,Increase active state-set agreement evidence
5021,7df4fb09,2026-04-01T10:58:44-07:00,failed,0,0,Tighten late active-island rejection further
5022,6242aec9,2026-04-01T11:10:12-07:00,failed,0,0,Increase exact active-state evidence further
5023,bddf3b57,2026-04-01T11:18:11-07:00,failed,0,0,Tighten late active-island rejection after active-state boost
5024,a521357c,2026-04-01T11:26:38-07:00,failed,0,0,Finish late active-island cleanup after active-state boost
5025,ac63928f,2026-04-01T11:39:25-07:00,failed,0,0,Increase exact active-subject evidence
5026,c80bc59d,2026-04-01T11:47:19-07:00,failed,0,0,Finish late active-island cleanup after active-subject boost
5027,e3360ae3,2026-04-01T11:55:18-07:00,failed,0,0,Complete late active-island cleanup after active-subject boost
5028,ebdaceb1,2026-04-01T12:03:08-07:00,failed,0,0,Zero residual late active-island leakage after active-subject boost
5029,7051c8ac,2026-04-01T12:19:52-07:00,failed,0,0,Increase first active-timing evidence
5030,5f755c17,2026-04-01T12:27:52-07:00,failed,0,0,Finish late active-island cleanup after timing boost
5031,e7c023e5,2026-04-01T12:35:46-07:00,failed,0,0,Complete late active-island cleanup after timing boost
5032,b0cecbc9,2026-04-01T12:50:19-07:00,failed,0,0,Increase last active-timing evidence
5033,4c6db6af,2026-04-01T12:58:12-07:00,failed,0,0,Finish late active-island cleanup after last timing boost
5034,85579fe4,2026-04-01T13:06:06-07:00,failed,0,0,Zero residual late active-island leakage after last timing boost
5035,e750b612,2026-04-01T13:13:53-07:00,failed,0,0,Eliminate final late active-island residue after last timing boost
5036,6c970a24,2026-04-01T13:30:51-07:00,failed,0,0,Increase subject persistence evidence
5037,8ae83c46,2026-04-01T13:38:43-07:00,failed,0,0,Finish late active-island cleanup after persistence boost
5038,aa85e381,2026-04-01T13:46:38-07:00,failed,0,0,Zero residual late active-island leakage after persistence boost
5039,1ee1f9af,2026-04-01T13:54:29-07:00,failed,0,0,Eliminate final late active-island residue after persistence boost
5040,aa01ed41,2026-04-01T14:02:23-07:00,failed,0,0,Clear final late active-island noise after persistence boost
5041,a5f5d41e,2026-04-01T14:11:25-07:00,failed,0,0,Increase subject-set agreement evidence
5042,78073088,2026-04-01T14:19:34-07:00,failed,0,0,Tighten unknown-family contamination and island penalties
5043,517f7756,2026-04-01T14:23:04-07:00,failed,0,0,Tighten contradiction cleanup for unknown-family queries
5044,a43cdaa8,2026-04-01T14:41:54-07:00,failed,0,0,Increase timed transition-pair evidence
5045,a5c63d26,2026-04-01T14:49:47-07:00,failed,0,0,Finish late active-island cleanup after timed transition boost
5046,c4d6b6f7,2026-04-01T14:57:41-07:00,failed,0,0,Clear final late active-island residue after timed transition boost
5047,6bbedc32,2026-04-01T15:05:29-07:00,failed,0,0,Remove last late active-island residue after timed transition boost
5048,21ce7c21,2026-04-01T15:08:56-07:00,failed,0,0,Back off over-strong late active-island penalty
5049,373a4fb5,2026-04-01T15:22:40-07:00,failed,0,0,Restore published late active-island penalty baseline
5050,6d237195,2026-04-01T15:26:26-07:00,failed,0,0,Refine late active-island cleanup for timed transition scoring
5051,85ffb858,2026-04-01T15:33:06-07:00,failed,0,0,Restore proven timed-transition matcher baseline
5052,053f2948,2026-04-01T15:35:24-07:00,failed,0,0,Add host identification regression floors
5053,495ed274,2026-04-01T15:41:52-07:00,failed,0,0,Preserve identification regression floors during refresh
5054,9f05eeaf,2026-04-01T15:55:11-07:00,failed,0,0,Add semantic truth regression baseline
5055,07c7f21d,2026-04-01T16:05:21-07:00,failed,0,0,Add semantic regression drift report
5056,a275de06,2026-04-01T16:14:21-07:00,failed,0,0,Add frame-meta regression baseline
5057,636cec10,2026-04-01T16:24:26-07:00,failed,0,0,Add frame image regression baseline
5058,90e8c851,2026-04-01T16:33:50-07:00,failed,0,0,Add consolidated capture regression report
5059,8d6a0684,2026-04-01T16:44:02-07:00,failed,0,0,Publish capture regression review page
5060,a1bee58a,2026-04-01T16:53:57-07:00,failed,0,0,Link capture regression review to artifacts
5061,88e9eb70,2026-04-01T17:04:00-07:00,failed,0,0,Show first drift in capture regression review
5062,7cb9aa68,2026-04-01T17:14:23-07:00,failed,0,0,Add capture regression status to verification summary
5063,00d5d345,2026-04-01T17:24:25-07:00,failed,0,0,Show expected vs actual in capture regression review
5064,35924d02,2026-04-01T17:34:27-07:00,failed,0,0,Link first drift assets in capture regression review
5065,49ab4b0e,2026-04-01T17:44:37-07:00,failed,0,0,Summarize tightest drift in capture regression report
5066,23e2d319,2026-04-01T17:54:38-07:00,failed,0,0,Link tightest drift summary to assets
5067,c1b2640c,2026-04-01T18:04:53-07:00,failed,0,0,Show capture regression failure totals
5068,29da6ca9,2026-04-01T18:14:59-07:00,failed,0,0,Add capture regression summary totals
5069,09720ec5,2026-04-01T18:25:12-07:00,failed,0,0,Expose first failed capture scenes in verification summary
5070,9d9f201b,2026-04-01T18:35:35-07:00,failed,0,0,Verify capture regression summary consistency
5071,506967de,2026-04-01T18:45:37-07:00,failed,0,0,Assert capture regression summary during refresh
5072,d956a7cf,2026-04-01T18:55:30-07:00,failed,0,0,Print capture regression summary in verifier
5073,db9b3f56,2026-04-01T19:05:53-07:00,failed,0,0,Link main host index to review dashboards
5074,533e3d1f,2026-04-01T19:15:50-07:00,failed,0,0,Add review dashboard paths to verification summary
5075,1e06f4d6,2026-04-01T19:25:58-07:00,failed,0,0,Verify dashboard paths in verification summary
5076,6dc972e4,2026-04-01T19:36:52-07:00,failed,0,0,Assert dashboard paths during refresh
5077,a0dd4d96,2026-04-01T19:46:18-07:00,failed,0,0,Require dashboards in host index renderer
5078,ba0d7614,2026-04-01T19:56:27-07:00,failed,0,0,Verify dashboard links in manifest
5079,6ece7dd4,2026-04-01T20:06:38-07:00,failed,0,0,Assert dashboard links in manifest during refresh
5080,abae8aa0,2026-04-01T20:17:04-07:00,failed,0,0,Verify dashboard links in HTML entrypoints
5081,d3b1cf97,2026-04-01T20:27:19-07:00,failed,0,0,Verify key frame links in identification review
5082,d69b3c02,2026-04-01T20:37:03-07:00,failed,0,0,Verify scene drilldown links in capture review
5083,c3a2f5ad,2026-04-01T20:47:12-07:00,failed,0,0,Print dashboard paths in verifier output
5084,b19c7512,2026-04-01T20:57:20-07:00,failed,0,0,Print dashboard paths during refresh
5085,5a2e60bb,2026-04-01T21:07:38-07:00,failed,0,0,Add dashboard paths to verification summary text
5086,4806bb93,2026-04-01T21:17:42-07:00,failed,0,0,Verify dashboard paths in summary text
5087,0f55e84e,2026-04-01T21:27:51-07:00,failed,0,0,Assert dashboard paths in summary text during refresh
5088,222ce037,2026-04-01T21:38:20-07:00,failed,0,0,Verify capture review totals against report
5089,ce4dc134,2026-04-01T21:48:29-07:00,failed,0,0,Verify tightest drift summary in capture review
5090,991a7a93,2026-04-01T21:59:12-07:00,failed,0,0,Link identification review to audit artifacts
5091,7f8d18d0,2026-04-01T22:08:37-07:00,failed,0,0,Cross-link identification and capture dashboards
5092,a7f869f1,2026-04-01T22:18:45-07:00,failed,0,0,Cross-link capture and identification dashboards
5093,4b12f053,2026-04-01T22:29:06-07:00,failed,0,0,Advertise top-level reports in host index
5094,2f5ccdda,2026-04-01T22:39:14-07:00,failed,0,0,Expose semantic truth and text summary in host index
5095,18cf8480,2026-04-01T22:49:18-07:00,failed,0,0,Link identification review to top-level summaries
5096,de361cff,2026-04-01T22:59:32-07:00,failed,0,0,Link capture review to top-level summaries
5097,a68d2016,2026-04-01T23:09:48-07:00,failed,0,0,Link capture review to semantic truth
5098,1192029c,2026-04-01T23:20:09-07:00,failed,0,0,Link identification review to capture component reports
5099,18f7d1d9,2026-04-01T23:33:39-07:00,failed,0,0,Expose identification audit paths in verification summary
5100,78b7b1e0,2026-04-01T23:40:45-07:00,failed,0,0,Expose capture audit paths in verification summary
5101,8739311c,2026-04-01T23:50:52-07:00,failed,0,0,Expose scene asset paths in verification summary
5102,57b82c10,2026-04-02T00:01:11-07:00,failed,0,0,Expose key frame paths in verification summary
5103,c66adab9,2026-04-02T00:11:59-07:00,failed,0,0,Expose key frame meta paths in verification summary
5104,25956b45,2026-04-02T00:21:50-07:00,failed,0,0,Expose regression baseline paths in verification summary
5105,7a3f5974,2026-04-02T00:31:33-07:00,failed,0,0,Expose identification floor paths in verification summary
5106,ab5e2073,2026-04-02T00:42:22-07:00,failed,0,0,Expose host truth paths in verification summary
5107,aa17aed4,2026-04-02T00:52:25-07:00,failed,0,0,Expose expectation paths in verification summary
5108,cbf8b870,2026-04-02T01:02:23-07:00,failed,0,0,Expose repro paths in verification summary
5109,7e6ecbfd,2026-04-02T01:11:42-07:00,failed,0,0,Expose expectation and repro HTML paths in verification summary
5110,aef1b4be,2026-04-02T01:22:13-07:00,failed,0,0,Expose host truth HTML path in verification summary
5111,86b5780a,2026-04-02T01:32:43-07:00,failed,0,0,Expose core artifact paths in verification summary
5112,af10824d,2026-04-02T01:43:03-07:00,failed,0,0,Expose review root in verification summary
5113,eb0b456d,2026-04-02T01:52:57-07:00,failed,0,0,Expose scene root paths in verification summary
5114,1008845d,2026-04-02T02:02:48-07:00,failed,0,0,Require absolute summary paths in verification artifacts
5115,378f272b,2026-04-02T02:12:29-07:00,failed,0,0,Require existing summary paths in verification artifacts
5116,f1e1cbb8,2026-04-02T02:22:35-07:00,failed,0,0,Require summary paths to stay under review root
5117,e6d0e4c2,2026-04-02T02:33:00-07:00,failed,0,0,Require summary path types in verification artifacts
5118,a8556938,2026-04-02T02:42:54-07:00,failed,0,0,Require unique summary paths in verification artifacts
5119,f1af0e99,2026-04-02T02:54:33-07:00,failed,0,0,Expand digest coverage to advertised summary files
5120,bdf99de0,2026-04-02T03:03:12-07:00,failed,0,0,Record summary path inventory count
5121,94e04b21,2026-04-02T03:13:22-07:00,failed,0,0,Record summary file and directory path counts
5122,021309aa,2026-04-02T03:23:46-07:00,failed,0,0,Record summary path class counts
5123,d9341b45,2026-04-02T03:33:37-07:00,failed,0,0,Record summary path map count
5124,1e92f11d,2026-04-02T03:43:44-07:00,failed,0,0,Record summary path map names
5125,5b759444,2026-04-02T03:53:57-07:00,failed,0,0,Record summary path map entry counts
5126,80eed130,2026-04-02T04:04:10-07:00,failed,0,0,Record summary path map type counts
5127,0d27cabf,2026-04-02T04:14:48-07:00,failed,0,0,Record summary path map file class counts
5128,8e33e0ea,2026-04-02T04:24:55-07:00,failed,0,0,Record summary path map entry names
5129,58304f61,2026-04-02T04:34:38-07:00,failed,0,0,Record summary path basenames
5130,650395f8,2026-04-02T04:44:52-07:00,failed,0,0,Record summary path relpaths
5131,a65bde9b,2026-04-02T04:55:11-07:00,failed,0,0,Record summary path depth counts
5132,7e2efee7,2026-04-02T05:04:59-07:00,failed,0,0,Record summary path max depth
5133,befec77e,2026-04-02T05:15:21-07:00,failed,0,0,Record summary path min nonroot depth
5134,4a627ee4,2026-04-02T05:26:33-07:00,failed,0,0,Record summary artifact input count
5135,4c71b6cd,2026-04-02T05:37:00-07:00,failed,0,0,Record summary artifact input names
5136,fe4a3aa2,2026-04-02T05:45:59-07:00,failed,0,0,Record summary artifact input names sha256
5137,90126a52,2026-04-02T05:56:02-07:00,failed,0,0,Record summary artifact input file class counts
5138,37e4ed35,2026-04-02T06:07:16-07:00,failed,0,0,Record summary artifact input depth counts
5139,ab37f979,2026-04-02T06:16:26-07:00,failed,0,0,Record summary artifact input max depth
5140,6f52b9fa,2026-04-02T06:26:47-07:00,failed,0,0,Record summary artifact input min nonroot depth
5141,29240746,2026-04-02T06:37:03-07:00,failed,0,0,Record summary artifact input parent dirs sha256
5142,ae687a76,2026-04-02T06:46:44-07:00,failed,0,0,Record summary artifact input parent dir count
5143,8c3736ed,2026-04-02T06:57:12-07:00,failed,0,0,Record summary artifact input parent dir depth counts
5144,33233f98,2026-04-02T07:07:03-07:00,failed,0,0,Record summary artifact input parent dir max depth
5145,30582bec,2026-04-02T07:17:04-07:00,failed,0,0,Record summary artifact input parent dir min nonroot depth
5146,6ad8ccab,2026-04-02T07:27:19-07:00,failed,0,0,Record summary artifact input parent dir basenames sha256
5147,919d688b,2026-04-02T07:37:28-07:00,failed,0,0,Record summary artifact input parent dir basename count
5148,8838cadb,2026-04-02T07:47:23-07:00,failed,0,0,Print digest contract summary in verifier
5149,69b6a0c0,2026-04-02T07:57:25-07:00,failed,0,0,Print digest contract summary during refresh
5150,6844e06b,2026-04-02T08:07:51-07:00,failed,0,0,Add digest contract token to summary text
5151,3f77c184,2026-04-02T08:17:53-07:00,failed,0,0,Store digest contract in summary json
5152,e9d41812,2026-04-02T08:27:57-07:00,failed,0,0,Assert digest contract during refresh
5153,8aad516c,2026-04-02T08:38:27-07:00,failed,0,0,Add digest contract sha256 to summaries
5154,58cbdc3e,2026-04-02T08:48:14-07:00,failed,0,0,Print digest contract sha256 in operator output
5155,954333fb,2026-04-02T08:58:56-07:00,failed,0,0,Version the digest contract schema
5156,f507900b,2026-04-02T09:08:58-07:00,failed,0,0,Record digest contract field count
5157,724431e7,2026-04-02T09:17:05-07:00,failed,0,0,Use canonical scene-default boot for MARY 1 capture
5158,dbd7158d,2026-04-02T09:25:41-07:00,failed,0,0,Unblock refresh before report generation completes
5159,a2d70f4d,2026-04-02T09:29:02-07:00,failed,0,0,Preserve frame regression baselines during refresh
5160,82e874f1,2026-04-02T09:37:28-07:00,failed,0,0,Fix verification summary contract hashing check
5161,70944b3d,2026-04-02T09:49:56-07:00,failed,0,0,Use canonical scene-default boot for FISHING 1 capture
5162,5ffa57e5,2026-04-02T10:26:09-07:00,failed,0,0,Normalize capture artifact paths for deterministic outputs
5163,24e3ab70,2026-04-02T10:42:06-07:00,failed,0,0,Remove run-specific noise from capture artifacts
5164,1007adf3,2026-04-02T11:26:16-07:00,failed,0,0,Add JOHNNY 1 to deterministic review scene set
5165,ba46cf85,2026-04-02T11:57:54-07:00,failed,0,0,Capture later deterministic JOHNNY 1 scene phase
5166,a380385d,2026-04-02T13:14:09-07:00,failed,0,0,Fix host exact ADS capture initialization
5167,ef30f589,2026-04-02T13:16:10-07:00,failed,0,0,Add exact scene boot mode for host captures
5168,98e56ed7,2026-04-02T13:25:07-07:00,failed,0,0,Probe exact MARY 3 in host review refresh
5169,7366134e,2026-04-02T13:46:04-07:00,failed,0,0,Use story-direct for exact scene host capture
5170,2dec6b9a,2026-04-02T13:54:17-07:00,failed,0,0,Use ADS boot for exact scene host capture
