sequence,short_hash,date,status,exe_size,iso_size,message
3318,03039edd,2025-12-26T10:30:38-08:00,exe_only,47104,0,Test streaming dynamic BMP loading with JOHNWALK.BMP
3319,4241cd66,2025-12-26T18:00:14-08:00,exe_only,47104,0,"Add multi-tile sprite infrastructure (rendering only, no loading yet)"
3320,748d8f5e,2025-12-27T10:04:03-08:00,exe_only,47104,0,Document multi-tile rendering breakthrough - VRAM collision identified
3321,4eac14c0,2025-12-27T10:20:52-08:00,exe_only,47104,0,Document multi-tile trials 10-12: 128px rows and 6-frame limit failures
3322,b3f86930,2025-12-27T10:32:38-08:00,exe_only,47104,0,Fix addPrim order: 2-frame multi-tile sprites now work
3323,4ad0e743,2025-12-27T10:51:18-08:00,exe_only,47104,0,"Checkpoint: 2-frame multi-tile works, 3+ breaks"
3324,dc36f7b1,2025-12-27T11:05:50-08:00,exe_only,47104,0,"Milestone: 3 frames work, 2 bottom tiles work, 3rd breaks"
3325,26e02eb6,2025-12-27T17:21:04-08:00,exe_only,47104,0,Multi-tile sprites: 3 frames with feet working (DrawSync fix)
3326,8c16610a,2025-12-29T06:51:46-08:00,exe_only,51200,0,WIP: Debug session - more frames loading but island/feet broken
3327,da4ad08f,2025-12-29T17:53:15-08:00,exe_only,47104,0,RAM-based rendering: All 42 animation frames load (background corruption WIP)
3328,8a1048e6,2025-12-30T09:03:36-08:00,exe_only,49152,0,"Milestone: All 42 Johnny frames render, bg stable, frames overlap"
3329,8b03359d,2025-12-30T09:19:52-08:00,exe_only,47104,0,MAJOR MILESTONE: Johnny walks on island with proper frame wiping!
3330,218ef15a,2025-12-30T09:24:37-08:00,exe_only,47104,0,Fix animation timing: 12 FPS instead of 4 FPS
3331,7b86b49c,2025-12-30T09:57:09-08:00,success,47104,2170896,chore: Reorganize repository structure
3332,bd34be6c,2025-12-30T10:22:00-08:00,success,47104,7963872,feat(ps1): Switch to pre-extracted resources for faster loading
3333,3664f7d7,2025-12-30T10:52:25-08:00,success,47104,7963872,"fix(ps1): Simplify SCR loading, improve BMP loading robustness"
3334,d01a8159,2025-12-30T10:55:33-08:00,success,47104,7963872,chore: Add release.sh script and VERSION file
3335,37b1ef3c,2026-01-10T21:06:39-08:00,success,57344,8295504,fix(ps1): Wrap sprite indices to handle 16-frame cap
3336,b82eb8bb,2026-01-10T22:46:41-08:00,success,61440,8335488,"feat(ps1): Add ADS scene support, fix VSync timing"
3337,632e8bbb,2026-01-10T22:50:28-08:00,success,61440,8335488,fix(ps1): Load ocean background before animation to fix black bar
3338,65735e14,2026-01-10T22:56:20-08:00,success,63488,8337840,"fix(ps1): Zero sprite pointers in ttmInitSlot, test GJHOT.TTM"
3339,0bf13f72,2026-01-10T23:01:04-08:00,success,63488,8337840,fix(ps1): Initialize nextTile to NULL in all PS1Surface allocations
3340,538e3ce2,2026-01-25T20:21:46-08:00,success,61440,8335488,"fix(ps1): Reduce sprite memory, remove debug markers, document issues"
3341,71f1d352,2026-02-07T08:55:53-08:00,success,86016,8363712,"feat(ps1): Enable storyPlay scene loop, implement grFadeOut, fix sprite persiste"
3342,37765bcf,2026-02-07T15:29:54-08:00,success,86016,8363712,"feat(ps1): Random scene selection, crash-safe resource loading, walk sprite clea"
3343,1f97b08c,2026-02-07T18:17:08-08:00,success,88064,8507184,"feat(ps1): SPU audio, fix sprite blink, fix scene variety, fix black backgrounds"
3344,5dbcdd16,2026-02-07T20:17:01-08:00,success,88064,8507184,fix(ps1): Fix black ocean by freeing tiles before SCR reload
3345,a87aa57f,2026-02-07T21:19:38-08:00,success,86016,8504832,"release: v0.3.3-ps1 - Fix ADS scene loading, skip broken LZW decompression"
3346,5ca5d741,2026-02-07T21:31:38-08:00,success,86016,8504832,fix(ps1): Fix sprite flickering by replacing cross-thread invalidation with safe
3347,0a1cf18c,2026-02-19T09:26:54-08:00,success,86016,8504832,fix(ps1): improve compositing speed and stabilize walk sprite replay
3348,d3a4649e,2026-02-20T12:15:50-08:00,success,86016,8504832,fix(ps1): stabilize long-run sprites with zero-copy indexed frames
3349,6090a735,2026-03-04T14:09:31-08:00,success,86016,8504832,Add PS1 debug-bar screenshot decoder tool
3350,55bf4240,2026-03-04T14:11:36-08:00,failed,0,0,Commit PS1 telemetry bar implementation and scene diagnostics
3351,12fdc519,2026-03-10T14:31:12-07:00,failed,0,0,PS1: intermediate black screen fixed
3352,0432a49b,2026-03-18T08:16:24-07:00,success,104448,34647312,Add PS1 pack pipeline and STAND restore pilot
3353,3d6fafa7,2026-03-18T08:39:09-07:00,success,104448,34647312,Add JOHNNY restore pilot and multi-pilot table
3354,81c1dcc3,2026-03-18T09:02:27-07:00,success,106496,34649664,Prime PS1 pilot scene resources from generated specs
3355,365ebb1a,2026-03-20T13:56:30-07:00,success,110592,34654368,Advance PS1 restore rollout and narrow pilot priming
3356,6dae8410,2026-03-21T09:02:06-07:00,success,112640,34656720,Fix PS1 first-handoff blackscreen
3357,21ada788,2026-03-21T12:01:27-07:00,success,112640,38904432,Add PSB sprite transcoder: pre-swap nibbles offline for PS1
3358,d85aa389,2026-03-21T12:04:38-07:00,success,116736,38909136,Merge branch 'worktree-agent-a0c0294b' into ps1
3359,4ce9d46f,2026-03-21T12:42:43-07:00,success,122880,38916192,Add PSB-backed scene packs and refresh restore artifacts
3360,f2c33ca3,2026-03-21T17:15:34-07:00,success,122880,38916192,"PS1 micro-optimizations: dirty-rect, palette LUT, compositing merge, hash lookup"
3361,84021fb6,2026-03-21T20:10:23-07:00,success,122880,38916192,"Add headless regtest harness, test instrumentation, refresh docs and research ar"
3362,bfce49c7,2026-03-21T21:07:39-07:00,success,122880,38916192,"Fix PS1 audio: correct ADSR, key-off before reuse, L1+SELECT mute"
3363,2069f333,2026-03-22T07:33:27-07:00,success,122880,38916192,Add visual scene and sprite detection system for automated testing
3364,b4476f3d,2026-03-22T10:28:49-07:00,success,131072,38925600,"Add pause menu, game features, closed captions, and accessibility stubs"
3365,a64524c4,2026-03-28T09:05:42-07:00,failed,0,0,Add canonical host baseline reference corpus
3366,7a3d4b49,2026-03-28T22:29:45-07:00,failed,0,0,Add HTML output for PS1 reference compares
3367,5b776e5a,2026-03-29T10:25:13-07:00,success,122880,38916192,Restore clean buildable state from f2c33ca3
3368,69432ead,2026-03-29T10:27:58-07:00,success,122880,38916192,Add story single boot mode for exact-scene PS1 testing
3369,d3b36ccc,2026-03-29T10:30:04-07:00,success,122880,38916192,Update regtest timing: 9000 frames (150 sec) for scene content
3370,4054755a,2026-03-29T12:04:01-07:00,success,122880,38916192,Add seed support and direct scene path for deterministic validation
3371,9d8ef531,2026-03-29T12:05:36-07:00,success,122880,38916192,Add local vision classifier reference pipeline
3372,0fadf79d,2026-03-29T12:53:17-07:00,success,122880,38916192,Expand vision pipeline publishing artifacts
3373,eadff0cf,2026-03-31T13:05:34-07:00,failed,0,0,Stabilize host truth expectations and reproducibility
3374,437895b8,2026-03-31T13:21:02-07:00,failed,0,0,Add refresh command for strict host truth review
3375,7e29e0e7,2026-03-31T13:39:12-07:00,failed,0,0,Harden host scene capture validation and timeouts
3376,25630be3,2026-03-31T13:48:16-07:00,failed,0,0,Isolate host review refresh from stale capture processes
3377,5569018e,2026-03-31T13:58:23-07:00,failed,0,0,Clean refresh temp state and orphaned Xvfb
3378,7719b911,2026-03-31T14:08:30-07:00,failed,0,0,Add canonical host review verification summary
3379,d92d45ce,2026-03-31T14:18:36-07:00,failed,0,0,Add stable digest to host review verification summary
3380,8eea65d6,2026-03-31T14:21:01-07:00,failed,0,0,Refuse refresh on dirty tracked host review inputs
3381,00367d90,2026-03-31T14:31:26-07:00,failed,0,0,Add read-only host review verifier
3382,8165b566,2026-03-31T14:41:00-07:00,failed,0,0,Emit one-line host review verification summary
3383,995926bb,2026-03-31T14:51:13-07:00,failed,0,0,Add negative test for host review verifier
3384,6b4a89b9,2026-03-31T15:01:30-07:00,failed,0,0,Add head-mismatch negative test for host review verifier
3385,93682af5,2026-03-31T15:11:59-07:00,failed,0,0,Compile deterministic semantic truth from host metadata
3386,de95b66b,2026-03-31T15:21:55-07:00,failed,0,0,Enrich host semantic truth with states and reasons
3387,a297794e,2026-03-31T15:32:03-07:00,failed,0,0,Add scene signatures and transition semantics
3388,304fbd34,2026-03-31T15:41:57-07:00,failed,0,0,Add identification tokens to semantic truth
3389,b21f1152,2026-03-31T15:52:33-07:00,failed,0,0,Add semantic scene identification selfcheck
3390,ecc2b628,2026-03-31T16:02:18-07:00,failed,0,0,Require explicit identified status in scene matcher
3391,ed625ffe,2026-03-31T16:14:46-07:00,failed,0,0,Enforce identification confusion audit in host review
3392,aa848207,2026-03-31T16:23:26-07:00,failed,0,0,Require ratio separation in scene identification audit
3393,5c180389,2026-03-31T16:35:42-07:00,failed,0,0,Audit partial-timeline scene identification robustness
3394,f7125dd0,2026-03-31T16:54:59-07:00,failed,0,0,Require rejection of low-signal challenge queries
3395,7b4f6fa2,2026-03-31T17:14:12-07:00,failed,0,0,Audit temporal stability of scene identification
3396,c05fe759,2026-03-31T17:23:41-07:00,failed,0,0,Weight active-frame evidence in scene matching
3397,0beaa9a5,2026-03-31T17:33:52-07:00,failed,0,0,Require monotonic temporal identification confidence
3398,62df9674,2026-03-31T17:45:04-07:00,failed,0,0,Expand challenge-set rejection coverage
3399,14ab86d8,2026-03-31T17:54:01-07:00,failed,0,0,Add evidence summaries to scene matcher output
3400,a44708fa,2026-03-31T18:04:52-07:00,failed,0,0,Publish HTML review for identification audits
3401,9cd84885,2026-03-31T18:15:35-07:00,failed,0,0,Link identification review to captured frames
3402,dcc04398,2026-03-31T18:25:29-07:00,failed,0,0,Add frame thumbnails to identification review
3403,07270647,2026-03-31T18:34:39-07:00,failed,0,0,Show evidence delta in identification review
3404,9747ae91,2026-03-31T18:45:13-07:00,failed,0,0,Add semantic scene summaries to identification review
3405,45c80807,2026-03-31T18:54:54-07:00,failed,0,0,Summarize query-specific semantic slices
3406,042f8c35,2026-03-31T19:04:43-07:00,failed,0,0,Show active evidence profiles in identification review
3407,61efd98b,2026-03-31T19:15:08-07:00,failed,0,0,Require active evidence in identified query audits
3408,0208559c,2026-03-31T19:25:14-07:00,failed,0,0,Require semantic evidence in scene matcher decisions
3409,937f2f1e,2026-03-31T19:35:33-07:00,failed,0,0,Add pose alignment to scene matcher scoring
3410,880d603b,2026-03-31T19:45:29-07:00,failed,0,0,Add pose-conflict challenge queries
3411,b1be1f67,2026-03-31T19:55:32-07:00,failed,0,0,Enforce confidence ceilings on challenge queries
3412,8387cea1,2026-03-31T20:05:40-07:00,failed,0,0,Show challenge confidence budgets in review
3413,14e04b7e,2026-03-31T20:16:14-07:00,failed,0,0,Add challenge budgets to verification summaries
3414,cfef612d,2026-03-31T20:26:33-07:00,failed,0,0,Add challenge headroom metrics to audits and summaries
3415,8dc5063d,2026-03-31T20:36:32-07:00,failed,0,0,Highlight tight challenge headroom in review
3416,d45ebd95,2026-03-31T20:46:51-07:00,failed,0,0,Count tight challenge budgets in verification summary
3417,a82563cc,2026-03-31T20:56:53-07:00,failed,0,0,Add risk status to summaries and review
3418,feea1726,2026-03-31T21:04:54-07:00,failed,0,0,Derive review risk from challenge headroom
3419,e8bcc5c9,2026-03-31T21:19:02-07:00,failed,0,0,Publish tightest challenge pressure in audits
3420,747c65b8,2026-03-31T21:37:39-07:00,failed,0,0,Reduce background-only scene match inflation
3421,44a50379,2026-03-31T21:47:52-07:00,failed,0,0,Penalize contradictory active-state scene matches
3422,75841792,2026-03-31T21:51:06-07:00,failed,0,0,Limit contradiction penalties to negative pressure only
3423,fa97d0f9,2026-03-31T21:55:44-07:00,failed,0,0,Tighten challenge realism and unknown-family scoring
3424,ab2f01b0,2026-03-31T22:07:51-07:00,failed,0,0,Weight context alignment in background scene matching
3425,0fd9d689,2026-03-31T22:17:49-07:00,failed,0,0,Reduce generic overlap bias in unknown-family matching
3426,b33f9c98,2026-03-31T22:27:43-07:00,failed,0,0,Penalize incomplete active coverage in unknown-family matching
3427,f88d37b9,2026-03-31T22:38:12-07:00,failed,0,0,Downweight single-active mixed unknown-family queries
3428,587de3e9,2026-03-31T22:48:33-07:00,failed,0,0,Further reduce confidence for single-active mixed slices
3429,b0f0e17c,2026-03-31T22:58:42-07:00,failed,0,0,Lower confidence for background-plus-active mixed slices
3430,ed373db8,2026-03-31T23:13:37-07:00,failed,0,0,Downweight generic overlap in unknown-family scene matching
3431,102c2757,2026-03-31T23:22:28-07:00,failed,0,0,Add transition-pattern alignment to scene matching
3432,b554734a,2026-03-31T23:40:06-07:00,failed,0,0,Add context-timeline alignment to scene matching
3433,e1a08407,2026-03-31T23:51:44-07:00,failed,0,0,Add subject timing and persistence to scene matching
3434,3cbbf02d,2026-03-31T23:55:32-07:00,failed,0,0,Gate subject timing boosts on active alignment
3435,c093c847,2026-04-01T00:10:39-07:00,failed,0,0,Add subject exit and recovery semantics to scene matching
3436,5cf09c67,2026-04-01T00:20:28-07:00,failed,0,0,Add actor phase sequencing to scene matching
3437,dd3ff661,2026-04-01T00:30:57-07:00,failed,0,0,Tighten unknown-family state-sequence penalties
3438,fef19f6d,2026-04-01T00:42:35-07:00,failed,0,0,Add transition-pair sequencing to scene matching
3439,58ec878e,2026-04-01T01:01:13-07:00,failed,0,0,Add timed transition sequencing to scene matching
3440,a63bea53,2026-04-01T01:10:56-07:00,failed,0,0,Add subject-activity sequencing to scene matching
3441,feb85999,2026-04-01T01:20:33-07:00,failed,0,0,Reduce mixed-slice subject-activity confidence
3442,c7fca140,2026-04-01T01:31:33-07:00,failed,0,0,Reclassify separated mixed unknown-family slices
3443,032e9ff1,2026-04-01T01:52:30-07:00,failed,0,0,Expose borrowed-background risk in matcher and review
3444,0057fa50,2026-04-01T02:01:27-07:00,failed,0,0,Make borrowed-background mixes explicit decisions
3445,1d9c1376,2026-04-01T02:04:23-07:00,failed,0,0,Add background provenance alignment to scene matching
3446,61a0d56b,2026-04-01T02:13:30-07:00,failed,0,0,Penalize borrowed-background mismatch in scene matching
3447,ae7db329,2026-04-01T02:31:56-07:00,failed,0,0,Add query contamination profiling to scene matcher
3448,adb3282a,2026-04-01T02:41:43-07:00,failed,0,0,Penalize sparse active evidence in mixed scene queries
3449,05a1475b,2026-04-01T02:52:24-07:00,failed,0,0,Penalize fragmented active coverage in mixed queries
3450,56695e1c,2026-04-01T03:01:57-07:00,failed,0,0,Penalize active semantic diversity in mixed queries
3451,410f3ea2,2026-04-01T03:12:31-07:00,failed,0,0,Penalize late active islands in mixed queries
3452,34da30fa,2026-04-01T03:22:04-07:00,failed,0,0,Clamp unknown-family scene scores at zero
3453,1d39ecf2,2026-04-01T03:32:33-07:00,failed,0,0,Reduce generic overlap credit for background-only queries
3454,a64c8601,2026-04-01T03:42:30-07:00,failed,0,0,Penalize borrowed-background context carryover
3455,6ad7040a,2026-04-01T03:52:50-07:00,failed,0,0,Penalize blended active narratives in mixed queries
3456,8f8c1f36,2026-04-01T04:02:53-07:00,failed,0,0,Further reduce background-only overlap credit
3457,bfa8754c,2026-04-01T04:12:45-07:00,failed,0,0,Penalize overweight single-active alignment in mixed queries
3458,b0ff1b62,2026-04-01T04:23:08-07:00,failed,0,0,Penalize low-novelty multi-active mixed queries
3459,daf7b98f,2026-04-01T04:34:05-07:00,failed,0,0,Penalize late active island context carryover
3460,0ae83b79,2026-04-01T04:43:02-07:00,failed,0,0,Further reduce background-only semantic overlap credit
3461,cd015b13,2026-04-01T04:53:14-07:00,failed,0,0,Further tighten background-only low-signal scoring
3462,0e5c1faa,2026-04-01T05:03:27-07:00,failed,0,0,Trim residual background-only overlap scoring
3463,f9581bad,2026-04-01T05:17:43-07:00,failed,0,0,Trim low-signal background-only scene overlap further
3464,2e5a2ec3,2026-04-01T05:34:19-07:00,failed,0,0,Penalize borrowed background mismatch in single-active mixed queries
3465,f185bbe1,2026-04-01T05:44:00-07:00,failed,0,0,Further trim residual background-only scene credit
3466,64741f57,2026-04-01T05:54:10-07:00,failed,0,0,Reduce broad scene-similarity credit for background-only queries
3467,a21c91ce,2026-04-01T06:04:27-07:00,failed,0,0,Reduce scene-family bonus for background-only queries
3468,587aa745,2026-04-01T06:14:35-07:00,failed,0,0,Reduce frame-signature credit for background-only queries
3469,ce245671,2026-04-01T06:25:04-07:00,failed,0,0,Drop generic semantic overlap for background-only queries
3470,e90b0e93,2026-04-01T06:34:56-07:00,failed,0,0,Trim residual background-only structural overlap
3471,2632a91f,2026-04-01T06:44:58-07:00,failed,0,0,Lower residual transition and context credit for background-only queries
3472,d0262e81,2026-04-01T06:55:21-07:00,failed,0,0,Remove broad scene-summary signals from background-only queries
3473,5af4d855,2026-04-01T07:05:29-07:00,failed,0,0,Return saved-zone layer to the surface pool
3474,c82c1aac,2026-04-01T07:09:04-07:00,failed,0,0,Increase host surface pool headroom for deterministic capture
3475,3a2127fa,2026-04-01T07:25:46-07:00,failed,0,0,Remove final context-set credit from background-only queries
3476,554de336,2026-04-01T07:36:57-07:00,failed,0,0,Remove background-only family bonus entirely
3477,60437f8e,2026-04-01T07:57:02-07:00,failed,0,0,Increase exact active-state evidence in scene matching
3478,7b582d28,2026-04-01T08:02:19-07:00,failed,0,0,Balance exact active-state boosts for unknown-family queries
3479,15ec31cc,2026-04-01T08:16:45-07:00,failed,0,0,Increase exact active-subject evidence in scene matching
3480,b535f89b,2026-04-01T08:28:04-07:00,failed,0,0,Promote active state-set alignment in scene matching
3481,e572d076,2026-04-01T08:37:01-07:00,failed,0,0,Increase actor-bearing scene-family evidence
3482,65b29ffd,2026-04-01T08:47:35-07:00,failed,0,0,Increase exact active-state evidence in scene matching
3483,27a26a90,2026-04-01T08:57:33-07:00,failed,0,0,Strengthen exact actor-bearing context alignment
3484,780e7db0,2026-04-01T09:07:53-07:00,failed,0,0,Increase active pose-set alignment weight
3485,cd26e6ad,2026-04-01T09:18:18-07:00,failed,0,0,Promote scene-trait alignment in scene matching
3486,4af1b928,2026-04-01T09:28:26-07:00,failed,0,0,Gate generic pose and activity overlap on active alignment
3487,c156ec87,2026-04-01T09:37:27-07:00,failed,0,0,Gate generic token overlap on active alignment
3488,009fd1ec,2026-04-01T09:47:55-07:00,failed,0,0,Gate exact subject and context matches on active alignment
3489,2295fc7a,2026-04-01T09:57:57-07:00,failed,0,0,Reduce non-active shared-frame overlap credit
3490,13616579,2026-04-01T10:08:04-07:00,failed,0,0,Increase active-frame coverage evidence
3491,dedcfc21,2026-04-01T10:18:22-07:00,failed,0,0,Increase late active-island rejection pressure
3492,4adfe197,2026-04-01T10:48:39-07:00,failed,0,0,Increase active state-set agreement evidence
3493,7df4fb09,2026-04-01T10:58:44-07:00,failed,0,0,Tighten late active-island rejection further
3494,6242aec9,2026-04-01T11:10:12-07:00,failed,0,0,Increase exact active-state evidence further
3495,bddf3b57,2026-04-01T11:18:11-07:00,failed,0,0,Tighten late active-island rejection after active-state boost
3496,a521357c,2026-04-01T11:26:38-07:00,failed,0,0,Finish late active-island cleanup after active-state boost
3497,ac63928f,2026-04-01T11:39:25-07:00,failed,0,0,Increase exact active-subject evidence
3498,c80bc59d,2026-04-01T11:47:19-07:00,failed,0,0,Finish late active-island cleanup after active-subject boost
3499,e3360ae3,2026-04-01T11:55:18-07:00,failed,0,0,Complete late active-island cleanup after active-subject boost
3500,ebdaceb1,2026-04-01T12:03:08-07:00,failed,0,0,Zero residual late active-island leakage after active-subject boost
3501,7051c8ac,2026-04-01T12:19:52-07:00,failed,0,0,Increase first active-timing evidence
3502,5f755c17,2026-04-01T12:27:52-07:00,failed,0,0,Finish late active-island cleanup after timing boost
3503,e7c023e5,2026-04-01T12:35:46-07:00,failed,0,0,Complete late active-island cleanup after timing boost
3504,b0cecbc9,2026-04-01T12:50:19-07:00,failed,0,0,Increase last active-timing evidence
3505,4c6db6af,2026-04-01T12:58:12-07:00,failed,0,0,Finish late active-island cleanup after last timing boost
3506,85579fe4,2026-04-01T13:06:06-07:00,failed,0,0,Zero residual late active-island leakage after last timing boost
3507,e750b612,2026-04-01T13:13:53-07:00,failed,0,0,Eliminate final late active-island residue after last timing boost
3508,6c970a24,2026-04-01T13:30:51-07:00,failed,0,0,Increase subject persistence evidence
3509,8ae83c46,2026-04-01T13:38:43-07:00,failed,0,0,Finish late active-island cleanup after persistence boost
3510,aa85e381,2026-04-01T13:46:38-07:00,failed,0,0,Zero residual late active-island leakage after persistence boost
3511,1ee1f9af,2026-04-01T13:54:29-07:00,failed,0,0,Eliminate final late active-island residue after persistence boost
3512,aa01ed41,2026-04-01T14:02:23-07:00,failed,0,0,Clear final late active-island noise after persistence boost
3513,a5f5d41e,2026-04-01T14:11:25-07:00,failed,0,0,Increase subject-set agreement evidence
3514,78073088,2026-04-01T14:19:34-07:00,failed,0,0,Tighten unknown-family contamination and island penalties
3515,517f7756,2026-04-01T14:23:04-07:00,failed,0,0,Tighten contradiction cleanup for unknown-family queries
3516,a43cdaa8,2026-04-01T14:41:54-07:00,failed,0,0,Increase timed transition-pair evidence
3517,a5c63d26,2026-04-01T14:49:47-07:00,failed,0,0,Finish late active-island cleanup after timed transition boost
3518,c4d6b6f7,2026-04-01T14:57:41-07:00,failed,0,0,Clear final late active-island residue after timed transition boost
3519,6bbedc32,2026-04-01T15:05:29-07:00,failed,0,0,Remove last late active-island residue after timed transition boost
3520,21ce7c21,2026-04-01T15:08:56-07:00,failed,0,0,Back off over-strong late active-island penalty
3521,373a4fb5,2026-04-01T15:22:40-07:00,failed,0,0,Restore published late active-island penalty baseline
3522,6d237195,2026-04-01T15:26:26-07:00,failed,0,0,Refine late active-island cleanup for timed transition scoring
3523,85ffb858,2026-04-01T15:33:06-07:00,failed,0,0,Restore proven timed-transition matcher baseline
3524,053f2948,2026-04-01T15:35:24-07:00,failed,0,0,Add host identification regression floors
3525,495ed274,2026-04-01T15:41:52-07:00,failed,0,0,Preserve identification regression floors during refresh
3526,9f05eeaf,2026-04-01T15:55:11-07:00,failed,0,0,Add semantic truth regression baseline
3527,07c7f21d,2026-04-01T16:05:21-07:00,failed,0,0,Add semantic regression drift report
3528,a275de06,2026-04-01T16:14:21-07:00,failed,0,0,Add frame-meta regression baseline
3529,636cec10,2026-04-01T16:24:26-07:00,failed,0,0,Add frame image regression baseline
3530,90e8c851,2026-04-01T16:33:50-07:00,failed,0,0,Add consolidated capture regression report
3531,8d6a0684,2026-04-01T16:44:02-07:00,failed,0,0,Publish capture regression review page
3532,a1bee58a,2026-04-01T16:53:57-07:00,failed,0,0,Link capture regression review to artifacts
3533,88e9eb70,2026-04-01T17:04:00-07:00,failed,0,0,Show first drift in capture regression review
3534,7cb9aa68,2026-04-01T17:14:23-07:00,failed,0,0,Add capture regression status to verification summary
3535,00d5d345,2026-04-01T17:24:25-07:00,failed,0,0,Show expected vs actual in capture regression review
3536,35924d02,2026-04-01T17:34:27-07:00,failed,0,0,Link first drift assets in capture regression review
3537,49ab4b0e,2026-04-01T17:44:37-07:00,failed,0,0,Summarize tightest drift in capture regression report
3538,23e2d319,2026-04-01T17:54:38-07:00,failed,0,0,Link tightest drift summary to assets
3539,c1b2640c,2026-04-01T18:04:53-07:00,failed,0,0,Show capture regression failure totals
3540,29da6ca9,2026-04-01T18:14:59-07:00,failed,0,0,Add capture regression summary totals
3541,09720ec5,2026-04-01T18:25:12-07:00,failed,0,0,Expose first failed capture scenes in verification summary
3542,9d9f201b,2026-04-01T18:35:35-07:00,failed,0,0,Verify capture regression summary consistency
3543,506967de,2026-04-01T18:45:37-07:00,failed,0,0,Assert capture regression summary during refresh
3544,d956a7cf,2026-04-01T18:55:30-07:00,failed,0,0,Print capture regression summary in verifier
3545,db9b3f56,2026-04-01T19:05:53-07:00,failed,0,0,Link main host index to review dashboards
3546,533e3d1f,2026-04-01T19:15:50-07:00,failed,0,0,Add review dashboard paths to verification summary
3547,1e06f4d6,2026-04-01T19:25:58-07:00,failed,0,0,Verify dashboard paths in verification summary
3548,6dc972e4,2026-04-01T19:36:52-07:00,failed,0,0,Assert dashboard paths during refresh
3549,a0dd4d96,2026-04-01T19:46:18-07:00,failed,0,0,Require dashboards in host index renderer
3550,ba0d7614,2026-04-01T19:56:27-07:00,failed,0,0,Verify dashboard links in manifest
3551,6ece7dd4,2026-04-01T20:06:38-07:00,failed,0,0,Assert dashboard links in manifest during refresh
3552,abae8aa0,2026-04-01T20:17:04-07:00,failed,0,0,Verify dashboard links in HTML entrypoints
3553,d3b1cf97,2026-04-01T20:27:19-07:00,failed,0,0,Verify key frame links in identification review
3554,d69b3c02,2026-04-01T20:37:03-07:00,failed,0,0,Verify scene drilldown links in capture review
3555,c3a2f5ad,2026-04-01T20:47:12-07:00,failed,0,0,Print dashboard paths in verifier output
3556,b19c7512,2026-04-01T20:57:20-07:00,failed,0,0,Print dashboard paths during refresh
3557,5a2e60bb,2026-04-01T21:07:38-07:00,failed,0,0,Add dashboard paths to verification summary text
3558,4806bb93,2026-04-01T21:17:42-07:00,failed,0,0,Verify dashboard paths in summary text
3559,0f55e84e,2026-04-01T21:27:51-07:00,failed,0,0,Assert dashboard paths in summary text during refresh
